{
    "researcherName": "Dr_Miniscope",
    "dataDirectory": "C:/Users/DBAharoni/Documents/Data",
    "directoryStructure": [
        "researcherName",
        "experimentName",
        "animalName",
        "date",
        "time"
    ],
    "animalName": "testMouse",
    "experimentName": "Linear Track Test",
    "recordLengthinSeconds": 600,
    "behaviorTracker": {
        "type": "DeepLabCut-Live",
        "pyEnvPath": "C:/Users/dbaha/.conda/envs/dlc-live",
        "modelPath": "C:/Users/dbaha/Documents/Data/DLC/DLC_Dog_resnet_50_iteration-0_shuffle-0",
        "modelPathHuman": "C:/Users/dbaha/Documents/Data/DLC/DLC_human_dancing_resnet_101_iteration-0_shuffle-1",
        "resize": 1,
        "pCutoffDisplay": 0.2,
        "windowX": 100,
        "windowY": 100,
        "windowScale": 0.5,
        "occupancyPlot": {
            "numBinsX": 100,
            "numBinsY": 100,
            "poseIdxToUse": [0, 1, 2, 3, 4]
        },
        "poseIdxForTraceDisplay": ["0wh", "1w", "2w"]
    }, 
    "traceDisplay": {
        "type": "scrolling",
        "windowX": 100,
        "windowY": 100,
        "width": 600,
        "height": 900
    },
    "devices": {
       "cameras": [
            {
                "deviceName": "MiniCAM0",
                "deviceType": "Minicam-Mono-XGA",
                "deviceID": 1,
				"showSaturation": true,
				"ROI": {
					"notes": "This defines the bounding box of the portion of the video that is saved to disk",
					"leftEdge": 10,
					"topEdge": 20,
					"width": 300,
					"height": 200
				},
                "cameraCalibrationFileLocation": "",
                "compressionOptions": ["MJPG","MJ2C","XVID","FFV1"],
                "compression": "FFV1",
                "framesPerFile": 1000,
                "windowScale": 0.75,
                "windowX": 800,
                "windowY": 600
            }
        ]
    }
}
